{
  "schema_version": "0.1",
  "video_id": "Smpl0Gochu1",
  "source": { "kind": "youtube_shorts", "title": "고추장 목살덮밥 (테스트용 가짜 영상)", "duration_ms": 12000 },
  "run": { "run_id": "fake-gold-1", "created_at": "2026-10-29T00:00:00Z", "stages": {} },
  "segments": [
    { "id": "title-0", "type": "title", "text": "고추장 목살덮밥 (테스트용 가짜 영상)" },
    { "id": "desc-0", "type": "description", "text": "재료: 목살 200g, 고추장 2큰술, 밥 1공기" },
    { "id": "asr-0", "type": "asr", "start_ms": 0, "end_ms": 4000, "text": "목살 200g을 먼저 구워요" },
    { "id": "asr-1", "type": "asr", "start_ms": 3500, "end_ms": 8000, "text": "고추장 2 큰술 넣고 볶아요" },
    { "id": "asr-2", "type": "asr", "start_ms": 8000, "end_ms": 12000, "text": "대파 송송 썰어 올려요" }
  ]
}
