{
  "schema_version": "0.1",
  "video_id": "Smpl0Kimch2",
  "source": { "kind": "youtube_shorts", "title": "김치볶음밥 (테스트용 가짜 영상)", "duration_ms": 6000 },
  "run": { "run_id": "fake-gold-2", "created_at": "2026-10-29T00:00:00Z", "stages": {} },
  "segments": [
    { "id": "desc-0", "type": "description", "text": "김치 1컵, 밥 1공기" },
    { "id": "asr-0", "type": "asr", "start_ms": 0, "end_ms": 3000, "text": "김치를 볶아요" },
    { "id": "asr-1", "type": "asr", "start_ms": 3000, "end_ms": 6000, "text": "밥 넣고 섞어요" }
  ]
}
